{"componentChunkName":"component---src-templates-docs-tsx","path":"/migration/v4/","result":{"data":{"site":{"siteMetadata":{"title":"CoreUI for React.js"}},"mdx":{"id":"2c027c7e-1c64-538b-a27f-863020214b02","body":"var _excluded = [\"components\"];\n\nfunction _extends() { _extends = Object.assign ? Object.assign.bind() : function (target) { for (var i = 1; i < arguments.length; i++) { var source = arguments[i]; for (var key in source) { if (Object.prototype.hasOwnProperty.call(source, key)) { target[key] = source[key]; } } } return target; }; return _extends.apply(this, arguments); }\n\nfunction _objectWithoutProperties(source, excluded) { if (source == null) return {}; var target = _objectWithoutPropertiesLoose(source, excluded); var key, i; if (Object.getOwnPropertySymbols) { var sourceSymbolKeys = Object.getOwnPropertySymbols(source); for (i = 0; i < sourceSymbolKeys.length; i++) { key = sourceSymbolKeys[i]; if (excluded.indexOf(key) >= 0) continue; if (!Object.prototype.propertyIsEnumerable.call(source, key)) continue; target[key] = source[key]; } } return target; }\n\nfunction _objectWithoutPropertiesLoose(source, excluded) { if (source == null) return {}; var target = {}; var sourceKeys = Object.keys(source); var key, i; for (i = 0; i < sourceKeys.length; i++) { key = sourceKeys[i]; if (excluded.indexOf(key) >= 0) continue; target[key] = source[key]; } return target; }\n\n/* @jsxRuntime classic */\n\n/* @jsx mdx */\nvar _frontmatter = {\n  \"name\": \"Migration to v4\",\n  \"description\": \"Track and review changes to the CoreUI for React.js components to help you migrate from v3 to v4.\",\n  \"menu\": \"Migration\",\n  \"route\": \"/migration/v4\"\n};\nvar layoutProps = {\n  _frontmatter: _frontmatter\n};\nvar MDXLayout = \"wrapper\";\nreturn function MDXContent(_ref) {\n  var components = _ref.components,\n      props = _objectWithoutProperties(_ref, _excluded);\n\n  return mdx(MDXLayout, _extends({}, layoutProps, props, {\n    components: components,\n    mdxType: \"MDXLayout\"\n  }), mdx(\"p\", null, \"CoreUI for React is the React.js version of CoreUI components library, so before read this migration guide, please check also \", mdx(\"a\", {\n    parentName: \"p\",\n    \"href\": \"https://coreui.io/docs/migration/\",\n    \"target\": \"_blank\",\n    \"rel\": \"nofollow\"\n  }, \"CoreUI 3 to 4 migration guide\"), \".\"), mdx(\"h2\", {\n    \"id\": \"components\",\n    \"style\": {\n      \"position\": \"relative\"\n    }\n  }, \"Components\", mdx(\"a\", {\n    parentName: \"h2\",\n    \"href\": \"#components\",\n    \"aria-label\": \"components permalink\",\n    \"className\": \"anchor-link after\"\n  }, mdx(\"span\", {\n    parentName: \"a\"\n  }, \"#\"))), mdx(\"h3\", {\n    \"id\": \"calert\",\n    \"style\": {\n      \"position\": \"relative\"\n    }\n  }, \"CAlert\", mdx(\"a\", {\n    parentName: \"h3\",\n    \"href\": \"#calert\",\n    \"aria-label\": \"calert permalink\",\n    \"className\": \"anchor-link after\"\n  }, mdx(\"span\", {\n    parentName: \"a\"\n  }, \"#\"))), mdx(\"ul\", null, mdx(\"li\", {\n    parentName: \"ul\"\n  }, \"Deprecated property \", mdx(\"inlineCode\", {\n    parentName: \"li\"\n  }, \"innerRef\"), \".\"), mdx(\"li\", {\n    parentName: \"ul\"\n  }, \"Deprecated property \", mdx(\"inlineCode\", {\n    parentName: \"li\"\n  }, \"fade\"), \".\"), mdx(\"li\", {\n    parentName: \"ul\"\n  }, \"Deprecated property \", mdx(\"inlineCode\", {\n    parentName: \"li\"\n  }, \"onShowChange\"), \".\"), mdx(\"li\", {\n    parentName: \"ul\"\n  }, \"Deprecated property \", mdx(\"inlineCode\", {\n    parentName: \"li\"\n  }, \"closeButton\"), \", use \", mdx(\"inlineCode\", {\n    parentName: \"li\"\n  }, \"dismissible\"), \" instead of.\"), mdx(\"li\", {\n    parentName: \"ul\"\n  }, \"Deprecated property \", mdx(\"inlineCode\", {\n    parentName: \"li\"\n  }, \"show\"), \", use \", mdx(\"inlineCode\", {\n    parentName: \"li\"\n  }, \"visible\"), \" instead of.\")), mdx(\"h3\", {\n    \"id\": \"cbadge\",\n    \"style\": {\n      \"position\": \"relative\"\n    }\n  }, \"CBadge\", mdx(\"a\", {\n    parentName: \"h3\",\n    \"href\": \"#cbadge\",\n    \"aria-label\": \"cbadge permalink\",\n    \"className\": \"anchor-link after\"\n  }, mdx(\"span\", {\n    parentName: \"a\"\n  }, \"#\"))), mdx(\"ul\", null, mdx(\"li\", {\n    parentName: \"ul\"\n  }, \"Deprecated property \", mdx(\"inlineCode\", {\n    parentName: \"li\"\n  }, \"innerRef\"), \".\"), mdx(\"li\", {\n    parentName: \"ul\"\n  }, \"Deprecated property \", mdx(\"inlineCode\", {\n    parentName: \"li\"\n  }, \"tag\"), \", use \", mdx(\"inlineCode\", {\n    parentName: \"li\"\n  }, \"component\"), \" instead of.\")), mdx(\"h3\", {\n    \"id\": \"cbreadcrumb\",\n    \"style\": {\n      \"position\": \"relative\"\n    }\n  }, \"CBreadcrumb\", mdx(\"a\", {\n    parentName: \"h3\",\n    \"href\": \"#cbreadcrumb\",\n    \"aria-label\": \"cbreadcrumb permalink\",\n    \"className\": \"anchor-link after\"\n  }, mdx(\"span\", {\n    parentName: \"a\"\n  }, \"#\"))), mdx(\"ul\", null, mdx(\"li\", {\n    parentName: \"ul\"\n  }, \"Deprecated property \", mdx(\"inlineCode\", {\n    parentName: \"li\"\n  }, \"innerRef\"), \".\")), mdx(\"h4\", {\n    \"id\": \"cbreadcrumbitem\",\n    \"style\": {\n      \"position\": \"relative\"\n    }\n  }, \"CBreadcrumbItem\", mdx(\"a\", {\n    parentName: \"h4\",\n    \"href\": \"#cbreadcrumbitem\",\n    \"aria-label\": \"cbreadcrumbitem permalink\",\n    \"className\": \"anchor-link after\"\n  }, mdx(\"span\", {\n    parentName: \"a\"\n  }, \"#\"))), mdx(\"ul\", null, mdx(\"li\", {\n    parentName: \"ul\"\n  }, \"Deprecated property \", mdx(\"inlineCode\", {\n    parentName: \"li\"\n  }, \"innerRef\"), \".\")), mdx(\"h3\", {\n    \"id\": \"cbutton\",\n    \"style\": {\n      \"position\": \"relative\"\n    }\n  }, \"CButton\", mdx(\"a\", {\n    parentName: \"h3\",\n    \"href\": \"#cbutton\",\n    \"aria-label\": \"cbutton permalink\",\n    \"className\": \"anchor-link after\"\n  }, mdx(\"span\", {\n    parentName: \"a\"\n  }, \"#\"))), mdx(\"ul\", null, mdx(\"li\", {\n    parentName: \"ul\"\n  }, \"Deprecated property \", mdx(\"inlineCode\", {\n    parentName: \"li\"\n  }, \"block\"), \".\"), mdx(\"li\", {\n    parentName: \"ul\"\n  }, \"Deprecated property \", mdx(\"inlineCode\", {\n    parentName: \"li\"\n  }, \"innerRef\"), \".\"), mdx(\"li\", {\n    parentName: \"ul\"\n  }, \"Deprecated property \", mdx(\"inlineCode\", {\n    parentName: \"li\"\n  }, \"pressed\"), \".\"), mdx(\"li\", {\n    parentName: \"ul\"\n  }, \"Deprecated property \", mdx(\"inlineCode\", {\n    parentName: \"li\"\n  }, \"tag\"), \", use \", mdx(\"inlineCode\", {\n    parentName: \"li\"\n  }, \"component\"), \" instead of.\")), mdx(\"h3\", {\n    \"id\": \"ccallout\",\n    \"style\": {\n      \"position\": \"relative\"\n    }\n  }, \"CCallout\", mdx(\"a\", {\n    parentName: \"h3\",\n    \"href\": \"#ccallout\",\n    \"aria-label\": \"ccallout permalink\",\n    \"className\": \"anchor-link after\"\n  }, mdx(\"span\", {\n    parentName: \"a\"\n  }, \"#\"))), mdx(\"ul\", null, mdx(\"li\", {\n    parentName: \"ul\"\n  }, \"Deprecated property \", mdx(\"inlineCode\", {\n    parentName: \"li\"\n  }, \"innerRef\"), \".\")), mdx(\"h3\", {\n    \"id\": \"ccard\",\n    \"style\": {\n      \"position\": \"relative\"\n    }\n  }, \"CCard\", mdx(\"a\", {\n    parentName: \"h3\",\n    \"href\": \"#ccard\",\n    \"aria-label\": \"ccard permalink\",\n    \"className\": \"anchor-link after\"\n  }, mdx(\"span\", {\n    parentName: \"a\"\n  }, \"#\"))), mdx(\"ul\", null, mdx(\"li\", {\n    parentName: \"ul\"\n  }, \"Deprecated property \", mdx(\"inlineCode\", {\n    parentName: \"li\"\n  }, \"innerRef\"), \".\"), mdx(\"li\", {\n    parentName: \"ul\"\n  }, \"Deprecated property \", mdx(\"inlineCode\", {\n    parentName: \"li\"\n  }, \"accentColor\"), \", use utilities \", mdx(\"inlineCode\", {\n    parentName: \"li\"\n  }, \"className=\\\"border-top-{#color} border-top-3\\\"\"), \" instead of.\")), mdx(\"h4\", {\n    \"id\": \"ccardbody\",\n    \"style\": {\n      \"position\": \"relative\"\n    }\n  }, \"CCardBody\", mdx(\"a\", {\n    parentName: \"h4\",\n    \"href\": \"#ccardbody\",\n    \"aria-label\": \"ccardbody permalink\",\n    \"className\": \"anchor-link after\"\n  }, mdx(\"span\", {\n    parentName: \"a\"\n  }, \"#\"))), mdx(\"ul\", null, mdx(\"li\", {\n    parentName: \"ul\"\n  }, \"Deprecated property \", mdx(\"inlineCode\", {\n    parentName: \"li\"\n  }, \"innerRef\"), \".\")), mdx(\"h4\", {\n    \"id\": \"ccardfooter\",\n    \"style\": {\n      \"position\": \"relative\"\n    }\n  }, \"CCardFooter\", mdx(\"a\", {\n    parentName: \"h4\",\n    \"href\": \"#ccardfooter\",\n    \"aria-label\": \"ccardfooter permalink\",\n    \"className\": \"anchor-link after\"\n  }, mdx(\"span\", {\n    parentName: \"a\"\n  }, \"#\"))), mdx(\"ul\", null, mdx(\"li\", {\n    parentName: \"ul\"\n  }, \"Deprecated property \", mdx(\"inlineCode\", {\n    parentName: \"li\"\n  }, \"innerRef\"), \".\")), mdx(\"h4\", {\n    \"id\": \"ccardgroup\",\n    \"style\": {\n      \"position\": \"relative\"\n    }\n  }, \"CCardGroup\", mdx(\"a\", {\n    parentName: \"h4\",\n    \"href\": \"#ccardgroup\",\n    \"aria-label\": \"ccardgroup permalink\",\n    \"className\": \"anchor-link after\"\n  }, mdx(\"span\", {\n    parentName: \"a\"\n  }, \"#\"))), mdx(\"ul\", null, mdx(\"li\", {\n    parentName: \"ul\"\n  }, \"Deprecated property \", mdx(\"inlineCode\", {\n    parentName: \"li\"\n  }, \"columns\"), \".\"), mdx(\"li\", {\n    parentName: \"ul\"\n  }, \"Deprecated property \", mdx(\"inlineCode\", {\n    parentName: \"li\"\n  }, \"deck\"), \".\"), mdx(\"li\", {\n    parentName: \"ul\"\n  }, \"Deprecated property \", mdx(\"inlineCode\", {\n    parentName: \"li\"\n  }, \"innerRef\"), \".\")), mdx(\"h4\", {\n    \"id\": \"ccardheader\",\n    \"style\": {\n      \"position\": \"relative\"\n    }\n  }, \"CCardHeader\", mdx(\"a\", {\n    parentName: \"h4\",\n    \"href\": \"#ccardheader\",\n    \"aria-label\": \"ccardheader permalink\",\n    \"className\": \"anchor-link after\"\n  }, mdx(\"span\", {\n    parentName: \"a\"\n  }, \"#\"))), mdx(\"ul\", null, mdx(\"li\", {\n    parentName: \"ul\"\n  }, \"Deprecated property \", mdx(\"inlineCode\", {\n    parentName: \"li\"\n  }, \"innerRef\"), \".\"), mdx(\"li\", {\n    parentName: \"ul\"\n  }, \"Deprecated property \", mdx(\"inlineCode\", {\n    parentName: \"li\"\n  }, \"tag\"), \", use \", mdx(\"inlineCode\", {\n    parentName: \"li\"\n  }, \"component\"), \" instead of.\")), mdx(\"h4\", {\n    \"id\": \"ccardimg\",\n    \"style\": {\n      \"position\": \"relative\"\n    }\n  }, \"CCardImg\", mdx(\"a\", {\n    parentName: \"h4\",\n    \"href\": \"#ccardimg\",\n    \"aria-label\": \"ccardimg permalink\",\n    \"className\": \"anchor-link after\"\n  }, mdx(\"span\", {\n    parentName: \"a\"\n  }, \"#\"))), mdx(\"ul\", null, mdx(\"li\", {\n    parentName: \"ul\"\n  }, mdx(\"strong\", {\n    parentName: \"li\"\n  }, \"Component renamed to \", mdx(\"inlineCode\", {\n    parentName: \"strong\"\n  }, \"CCardImg\"))), mdx(\"li\", {\n    parentName: \"ul\"\n  }, \"Deprecated property \", mdx(\"inlineCode\", {\n    parentName: \"li\"\n  }, \"variant\"), \", use \", mdx(\"inlineCode\", {\n    parentName: \"li\"\n  }, \"orientation\"), \" instead of.\")), mdx(\"h4\", {\n    \"id\": \"ccardimgoverlay\",\n    \"style\": {\n      \"position\": \"relative\"\n    }\n  }, \"CCardImgOverlay\", mdx(\"a\", {\n    parentName: \"h4\",\n    \"href\": \"#ccardimgoverlay\",\n    \"aria-label\": \"ccardimgoverlay permalink\",\n    \"className\": \"anchor-link after\"\n  }, mdx(\"span\", {\n    parentName: \"a\"\n  }, \"#\"))), mdx(\"ul\", null, mdx(\"li\", {\n    parentName: \"ul\"\n  }, mdx(\"strong\", {\n    parentName: \"li\"\n  }, \"Component renamed to \", mdx(\"inlineCode\", {\n    parentName: \"strong\"\n  }, \"CCardImgOverlay\"))), mdx(\"li\", {\n    parentName: \"ul\"\n  }, \"Deprecated property \", mdx(\"inlineCode\", {\n    parentName: \"li\"\n  }, \"innerRef\"), \".\"), mdx(\"li\", {\n    parentName: \"ul\"\n  }, \"Deprecated property \", mdx(\"inlineCode\", {\n    parentName: \"li\"\n  }, \"tag\"), \".\")), mdx(\"h4\", {\n    \"id\": \"ccardsubtitle\",\n    \"style\": {\n      \"position\": \"relative\"\n    }\n  }, \"CCardSubtitle\", mdx(\"a\", {\n    parentName: \"h4\",\n    \"href\": \"#ccardsubtitle\",\n    \"aria-label\": \"ccardsubtitle permalink\",\n    \"className\": \"anchor-link after\"\n  }, mdx(\"span\", {\n    parentName: \"a\"\n  }, \"#\"))), mdx(\"ul\", null, mdx(\"li\", {\n    parentName: \"ul\"\n  }, \"Deprecated property \", mdx(\"inlineCode\", {\n    parentName: \"li\"\n  }, \"innerRef\"), \".\"), mdx(\"li\", {\n    parentName: \"ul\"\n  }, \"Deprecated property \", mdx(\"inlineCode\", {\n    parentName: \"li\"\n  }, \"tag\"), \", use \", mdx(\"inlineCode\", {\n    parentName: \"li\"\n  }, \"component\"), \" instead of.\")), mdx(\"h4\", {\n    \"id\": \"ccardtext\",\n    \"style\": {\n      \"position\": \"relative\"\n    }\n  }, \"CCardText\", mdx(\"a\", {\n    parentName: \"h4\",\n    \"href\": \"#ccardtext\",\n    \"aria-label\": \"ccardtext permalink\",\n    \"className\": \"anchor-link after\"\n  }, mdx(\"span\", {\n    parentName: \"a\"\n  }, \"#\"))), mdx(\"ul\", null, mdx(\"li\", {\n    parentName: \"ul\"\n  }, \"Deprecated property \", mdx(\"inlineCode\", {\n    parentName: \"li\"\n  }, \"innerRef\"), \".\"), mdx(\"li\", {\n    parentName: \"ul\"\n  }, \"Deprecated property \", mdx(\"inlineCode\", {\n    parentName: \"li\"\n  }, \"tag\"), \", use \", mdx(\"inlineCode\", {\n    parentName: \"li\"\n  }, \"component\"), \" instead of.\")), mdx(\"h4\", {\n    \"id\": \"ccardtitle\",\n    \"style\": {\n      \"position\": \"relative\"\n    }\n  }, \"CCardTitle\", mdx(\"a\", {\n    parentName: \"h4\",\n    \"href\": \"#ccardtitle\",\n    \"aria-label\": \"ccardtitle permalink\",\n    \"className\": \"anchor-link after\"\n  }, mdx(\"span\", {\n    parentName: \"a\"\n  }, \"#\"))), mdx(\"ul\", null, mdx(\"li\", {\n    parentName: \"ul\"\n  }, \"Deprecated property \", mdx(\"inlineCode\", {\n    parentName: \"li\"\n  }, \"innerRef\"), \".\"), mdx(\"li\", {\n    parentName: \"ul\"\n  }, \"Deprecated property \", mdx(\"inlineCode\", {\n    parentName: \"li\"\n  }, \"tag\"), \", use \", mdx(\"inlineCode\", {\n    parentName: \"li\"\n  }, \"component\"), \" instead of.\")), mdx(\"h3\", {\n    \"id\": \"ccarousel\",\n    \"style\": {\n      \"position\": \"relative\"\n    }\n  }, \"CCarousel\", mdx(\"a\", {\n    parentName: \"h3\",\n    \"href\": \"#ccarousel\",\n    \"aria-label\": \"ccarousel permalink\",\n    \"className\": \"anchor-link after\"\n  }, mdx(\"span\", {\n    parentName: \"a\"\n  }, \"#\"))), mdx(\"ul\", null, mdx(\"li\", {\n    parentName: \"ul\"\n  }, \"Deprecated property \", mdx(\"inlineCode\", {\n    parentName: \"li\"\n  }, \"autoSlide\"), \".\"), mdx(\"li\", {\n    parentName: \"ul\"\n  }, \"Deprecated property \", mdx(\"inlineCode\", {\n    parentName: \"li\"\n  }, \"innerRef\"), \".\"), mdx(\"li\", {\n    parentName: \"ul\"\n  }, \"Deprecated property \", mdx(\"inlineCode\", {\n    parentName: \"li\"\n  }, \"activeIndex\"), \", use \", mdx(\"inlineCode\", {\n    parentName: \"li\"\n  }, \"index\"), \" instead of.\")), mdx(\"h4\", {\n    \"id\": \"ccarouselcontrol\",\n    \"style\": {\n      \"position\": \"relative\"\n    }\n  }, \"CCarouselControl\", mdx(\"a\", {\n    parentName: \"h4\",\n    \"href\": \"#ccarouselcontrol\",\n    \"aria-label\": \"ccarouselcontrol permalink\",\n    \"className\": \"anchor-link after\"\n  }, mdx(\"span\", {\n    parentName: \"a\"\n  }, \"#\"))), mdx(\"ul\", null, mdx(\"li\", {\n    parentName: \"ul\"\n  }, \"Component is depracated, use \", mdx(\"inlineCode\", {\n    parentName: \"li\"\n  }, \"<CCarousel controls>\"), \" instead of. \")), mdx(\"h4\", {\n    \"id\": \"ccarouselindicators\",\n    \"style\": {\n      \"position\": \"relative\"\n    }\n  }, \"CCarouselIndicators\", mdx(\"a\", {\n    parentName: \"h4\",\n    \"href\": \"#ccarouselindicators\",\n    \"aria-label\": \"ccarouselindicators permalink\",\n    \"className\": \"anchor-link after\"\n  }, mdx(\"span\", {\n    parentName: \"a\"\n  }, \"#\"))), mdx(\"ul\", null, mdx(\"li\", {\n    parentName: \"ul\"\n  }, \"Component is depracated, use \", mdx(\"inlineCode\", {\n    parentName: \"li\"\n  }, \"<CCarousel indicators>\"), \" instead of. \")), mdx(\"h4\", {\n    \"id\": \"ccarouselinner\",\n    \"style\": {\n      \"position\": \"relative\"\n    }\n  }, \"CCarouselInner\", mdx(\"a\", {\n    parentName: \"h4\",\n    \"href\": \"#ccarouselinner\",\n    \"aria-label\": \"ccarouselinner permalink\",\n    \"className\": \"anchor-link after\"\n  }, mdx(\"span\", {\n    parentName: \"a\"\n  }, \"#\"))), mdx(\"ul\", null, mdx(\"li\", {\n    parentName: \"ul\"\n  }, \"Component is depracated. \")), mdx(\"h3\", {\n    \"id\": \"ccollapse\",\n    \"style\": {\n      \"position\": \"relative\"\n    }\n  }, \"CCollapse\", mdx(\"a\", {\n    parentName: \"h3\",\n    \"href\": \"#ccollapse\",\n    \"aria-label\": \"ccollapse permalink\",\n    \"className\": \"anchor-link after\"\n  }, mdx(\"span\", {\n    parentName: \"a\"\n  }, \"#\"))), mdx(\"ul\", null, mdx(\"li\", {\n    parentName: \"ul\"\n  }, \"Deprecated property \", mdx(\"inlineCode\", {\n    parentName: \"li\"\n  }, \"innerRef\"), \".\"), mdx(\"li\", {\n    parentName: \"ul\"\n  }, \"Deprecated property \", mdx(\"inlineCode\", {\n    parentName: \"li\"\n  }, \"navbar\"), \".\"), mdx(\"li\", {\n    parentName: \"ul\"\n  }, \"Deprecated property \", mdx(\"inlineCode\", {\n    parentName: \"li\"\n  }, \"show\"), \", use \", mdx(\"inlineCode\", {\n    parentName: \"li\"\n  }, \"visible\"), \" instead of.\")), mdx(\"h4\", {\n    \"id\": \"ccreateelement\",\n    \"style\": {\n      \"position\": \"relative\"\n    }\n  }, \"CCreateElement\", mdx(\"a\", {\n    parentName: \"h4\",\n    \"href\": \"#ccreateelement\",\n    \"aria-label\": \"ccreateelement permalink\",\n    \"className\": \"anchor-link after\"\n  }, mdx(\"span\", {\n    parentName: \"a\"\n  }, \"#\"))), mdx(\"ul\", null, mdx(\"li\", {\n    parentName: \"ul\"\n  }, \"Component is depracated. \")), mdx(\"h3\", {\n    \"id\": \"cdropdown\",\n    \"style\": {\n      \"position\": \"relative\"\n    }\n  }, \"CDropdown\", mdx(\"a\", {\n    parentName: \"h3\",\n    \"href\": \"#cdropdown\",\n    \"aria-label\": \"cdropdown permalink\",\n    \"className\": \"anchor-link after\"\n  }, mdx(\"span\", {\n    parentName: \"a\"\n  }, \"#\"))), mdx(\"ul\", null, mdx(\"li\", {\n    parentName: \"ul\"\n  }, \"Deprecated property \", mdx(\"inlineCode\", {\n    parentName: \"li\"\n  }, \"innerRef\"), \".\"), mdx(\"li\", {\n    parentName: \"ul\"\n  }, \"Deprecated property \", mdx(\"inlineCode\", {\n    parentName: \"li\"\n  }, \"inNav\"), \", use \", mdx(\"inlineCode\", {\n    parentName: \"li\"\n  }, \"variant=\\\"nav-item\\\"\"), \" instead of.\"), mdx(\"li\", {\n    parentName: \"ul\"\n  }, \"Deprecated property \", mdx(\"inlineCode\", {\n    parentName: \"li\"\n  }, \"tag\"), \", use \", mdx(\"inlineCode\", {\n    parentName: \"li\"\n  }, \"component\"), \" instead of.\")), mdx(\"h4\", {\n    \"id\": \"cdropdownitem\",\n    \"style\": {\n      \"position\": \"relative\"\n    }\n  }, \"CDropdownitem\", mdx(\"a\", {\n    parentName: \"h4\",\n    \"href\": \"#cdropdownitem\",\n    \"aria-label\": \"cdropdownitem permalink\",\n    \"className\": \"anchor-link after\"\n  }, mdx(\"span\", {\n    parentName: \"a\"\n  }, \"#\"))), mdx(\"ul\", null, mdx(\"li\", {\n    parentName: \"ul\"\n  }, \"Deprecated property \", mdx(\"inlineCode\", {\n    parentName: \"li\"\n  }, \"color\"), \".\"), mdx(\"li\", {\n    parentName: \"ul\"\n  }, \"Deprecated property \", mdx(\"inlineCode\", {\n    parentName: \"li\"\n  }, \"divider\"), \".\"), mdx(\"li\", {\n    parentName: \"ul\"\n  }, \"Deprecated property \", mdx(\"inlineCode\", {\n    parentName: \"li\"\n  }, \"innerRef\"), \".\"), mdx(\"li\", {\n    parentName: \"ul\"\n  }, \"Deprecated property \", mdx(\"inlineCode\", {\n    parentName: \"li\"\n  }, \"header\"), \".\"), mdx(\"li\", {\n    parentName: \"ul\"\n  }, \"Deprecated property \", mdx(\"inlineCode\", {\n    parentName: \"li\"\n  }, \"onClick\"), \".\"), mdx(\"li\", {\n    parentName: \"ul\"\n  }, \"Deprecated property \", mdx(\"inlineCode\", {\n    parentName: \"li\"\n  }, \"tag\"), \", use \", mdx(\"inlineCode\", {\n    parentName: \"li\"\n  }, \"component\"), \" instead of.\")), mdx(\"h4\", {\n    \"id\": \"cdropdownmenu\",\n    \"style\": {\n      \"position\": \"relative\"\n    }\n  }, \"CDropdownMenu\", mdx(\"a\", {\n    parentName: \"h4\",\n    \"href\": \"#cdropdownmenu\",\n    \"aria-label\": \"cdropdownmenu permalink\",\n    \"className\": \"anchor-link after\"\n  }, mdx(\"span\", {\n    parentName: \"a\"\n  }, \"#\"))), mdx(\"ul\", null, mdx(\"li\", {\n    parentName: \"ul\"\n  }, \"Deprecated property \", mdx(\"inlineCode\", {\n    parentName: \"li\"\n  }, \"innerRef\"), \".\"), mdx(\"li\", {\n    parentName: \"ul\"\n  }, \"Deprecated property \", mdx(\"inlineCode\", {\n    parentName: \"li\"\n  }, \"modifiers\"), \".\"), mdx(\"li\", {\n    parentName: \"ul\"\n  }, \"Deprecated property \", mdx(\"inlineCode\", {\n    parentName: \"li\"\n  }, \"placement\"), \" , use \", mdx(\"inlineCode\", {\n    parentName: \"li\"\n  }, \"<CDropdown placement=\\\"...\\\">\"), \" instead of.\"), mdx(\"li\", {\n    parentName: \"ul\"\n  }, \"Deprecated property \", mdx(\"inlineCode\", {\n    parentName: \"li\"\n  }, \"show\"), \" , use \", mdx(\"inlineCode\", {\n    parentName: \"li\"\n  }, \"<CDropdown visible>\"), \" instead of.\")), mdx(\"h4\", {\n    \"id\": \"cdropdowntoggle\",\n    \"style\": {\n      \"position\": \"relative\"\n    }\n  }, \"CDropdownToggle\", mdx(\"a\", {\n    parentName: \"h4\",\n    \"href\": \"#cdropdowntoggle\",\n    \"aria-label\": \"cdropdowntoggle permalink\",\n    \"className\": \"anchor-link after\"\n  }, mdx(\"span\", {\n    parentName: \"a\"\n  }, \"#\"))), mdx(\"ul\", null, mdx(\"li\", {\n    parentName: \"ul\"\n  }, \"Deprecated property \", mdx(\"inlineCode\", {\n    parentName: \"li\"\n  }, \"innerRef\"), \".\"), mdx(\"li\", {\n    parentName: \"ul\"\n  }, \"Deprecated property \", mdx(\"inlineCode\", {\n    parentName: \"li\"\n  }, \"tag\"), \", use \", mdx(\"inlineCode\", {\n    parentName: \"li\"\n  }, \"component\"), \" instead of.\")), mdx(\"h3\", {\n    \"id\": \"cembed\",\n    \"style\": {\n      \"position\": \"relative\"\n    }\n  }, \"CEmbed\", mdx(\"a\", {\n    parentName: \"h3\",\n    \"href\": \"#cembed\",\n    \"aria-label\": \"cembed permalink\",\n    \"className\": \"anchor-link after\"\n  }, mdx(\"span\", {\n    parentName: \"a\"\n  }, \"#\"))), mdx(\"ul\", null, mdx(\"li\", {\n    parentName: \"ul\"\n  }, \"Component is depracated.\")), mdx(\"h3\", {\n    \"id\": \"cfade\",\n    \"style\": {\n      \"position\": \"relative\"\n    }\n  }, \"CFade\", mdx(\"a\", {\n    parentName: \"h3\",\n    \"href\": \"#cfade\",\n    \"aria-label\": \"cfade permalink\",\n    \"className\": \"anchor-link after\"\n  }, mdx(\"span\", {\n    parentName: \"a\"\n  }, \"#\"))), mdx(\"ul\", null, mdx(\"li\", {\n    parentName: \"ul\"\n  }, \"Component is depracated.\")), mdx(\"h3\", {\n    \"id\": \"cheader\",\n    \"style\": {\n      \"position\": \"relative\"\n    }\n  }, \"CHeader\", mdx(\"a\", {\n    parentName: \"h3\",\n    \"href\": \"#cheader\",\n    \"aria-label\": \"cheader permalink\",\n    \"className\": \"anchor-link after\"\n  }, mdx(\"span\", {\n    parentName: \"a\"\n  }, \"#\"))), mdx(\"ul\", null, mdx(\"li\", {\n    parentName: \"ul\"\n  }, \"Deprecated property \", mdx(\"inlineCode\", {\n    parentName: \"li\"\n  }, \"withSubheader\"), \".\"), mdx(\"li\", {\n    parentName: \"ul\"\n  }, \"Deprecated component \", mdx(\"inlineCode\", {\n    parentName: \"li\"\n  }, \"CHeaderNavItem\"), \", use \", mdx(\"inlineCode\", {\n    parentName: \"li\"\n  }, \"CNavItem\"), \" instead of.\"), mdx(\"li\", {\n    parentName: \"ul\"\n  }, \"Deprecated component \", mdx(\"inlineCode\", {\n    parentName: \"li\"\n  }, \"CHeaderNavLink\"), \", use \", mdx(\"inlineCode\", {\n    parentName: \"li\"\n  }, \"CNavLink\"), \" instead of.\")), mdx(\"h3\", {\n    \"id\": \"cimg\",\n    \"style\": {\n      \"position\": \"relative\"\n    }\n  }, \"CImg\", mdx(\"a\", {\n    parentName: \"h3\",\n    \"href\": \"#cimg\",\n    \"aria-label\": \"cimg permalink\",\n    \"className\": \"anchor-link after\"\n  }, mdx(\"span\", {\n    parentName: \"a\"\n  }, \"#\"))), mdx(\"ul\", null, mdx(\"li\", {\n    parentName: \"ul\"\n  }, mdx(\"strong\", {\n    parentName: \"li\"\n  }, \"Component renamed to \", mdx(\"inlineCode\", {\n    parentName: \"strong\"\n  }, \"CImage\"))), mdx(\"li\", {\n    parentName: \"ul\"\n  }, \"Deprecated property \", mdx(\"inlineCode\", {\n    parentName: \"li\"\n  }, \"block\"), \".\"), mdx(\"li\", {\n    parentName: \"ul\"\n  }, \"Deprecated property \", mdx(\"inlineCode\", {\n    parentName: \"li\"\n  }, \"innerRef\"), \".\"), mdx(\"li\", {\n    parentName: \"ul\"\n  }, \"Deprecated property \", mdx(\"inlineCode\", {\n    parentName: \"li\"\n  }, \"fluidGrow\"), \".\"), mdx(\"li\", {\n    parentName: \"ul\"\n  }, \"Deprecated property \", mdx(\"inlineCode\", {\n    parentName: \"li\"\n  }, \"placeholderColor\"), \".\"), mdx(\"li\", {\n    parentName: \"ul\"\n  }, \"Deprecated property \", mdx(\"inlineCode\", {\n    parentName: \"li\"\n  }, \"shape\"), \".\"), mdx(\"li\", {\n    parentName: \"ul\"\n  }, \"Deprecated property \", mdx(\"inlineCode\", {\n    parentName: \"li\"\n  }, \"tag\"), \".\")), mdx(\"h3\", {\n    \"id\": \"cjumbotron\",\n    \"style\": {\n      \"position\": \"relative\"\n    }\n  }, \"CJumbotron\", mdx(\"a\", {\n    parentName: \"h3\",\n    \"href\": \"#cjumbotron\",\n    \"aria-label\": \"cjumbotron permalink\",\n    \"className\": \"anchor-link after\"\n  }, mdx(\"span\", {\n    parentName: \"a\"\n  }, \"#\"))), mdx(\"ul\", null, mdx(\"li\", {\n    parentName: \"ul\"\n  }, \"Component is depracated.\")), mdx(\"h3\", {\n    \"id\": \"clistgroup\",\n    \"style\": {\n      \"position\": \"relative\"\n    }\n  }, \"CListGroup\", mdx(\"a\", {\n    parentName: \"h3\",\n    \"href\": \"#clistgroup\",\n    \"aria-label\": \"clistgroup permalink\",\n    \"className\": \"anchor-link after\"\n  }, mdx(\"span\", {\n    parentName: \"a\"\n  }, \"#\"))), mdx(\"ul\", null, mdx(\"li\", {\n    parentName: \"ul\"\n  }, \"Deprecated property \", mdx(\"inlineCode\", {\n    parentName: \"li\"\n  }, \"accent\"), \".\"), mdx(\"li\", {\n    parentName: \"ul\"\n  }, \"Deprecated property \", mdx(\"inlineCode\", {\n    parentName: \"li\"\n  }, \"horizontal\"), \", use \", mdx(\"inlineCode\", {\n    parentName: \"li\"\n  }, \"layout\"), \" instead of.\"), mdx(\"li\", {\n    parentName: \"ul\"\n  }, \"Deprecated property \", mdx(\"inlineCode\", {\n    parentName: \"li\"\n  }, \"innerRef\"), \".\"), mdx(\"li\", {\n    parentName: \"ul\"\n  }, \"Deprecated property \", mdx(\"inlineCode\", {\n    parentName: \"li\"\n  }, \"tag\"), \", use \", mdx(\"inlineCode\", {\n    parentName: \"li\"\n  }, \"component\"), \" instead of.\")), mdx(\"h4\", {\n    \"id\": \"clistgroupitem\",\n    \"style\": {\n      \"position\": \"relative\"\n    }\n  }, \"CListGroupItem\", mdx(\"a\", {\n    parentName: \"h4\",\n    \"href\": \"#clistgroupitem\",\n    \"aria-label\": \"clistgroupitem permalink\",\n    \"className\": \"anchor-link after\"\n  }, mdx(\"span\", {\n    parentName: \"a\"\n  }, \"#\"))), mdx(\"ul\", null, mdx(\"li\", {\n    parentName: \"ul\"\n  }, \"Deprecated property \", mdx(\"inlineCode\", {\n    parentName: \"li\"\n  }, \"accent\"), \".\"), mdx(\"li\", {\n    parentName: \"ul\"\n  }, \"Deprecated property \", mdx(\"inlineCode\", {\n    parentName: \"li\"\n  }, \"action\"), \", use property \", mdx(\"inlineCode\", {\n    parentName: \"li\"\n  }, \"component=\\\"a\\\"\"), \" or \", mdx(\"inlineCode\", {\n    parentName: \"li\"\n  }, \"component=\\\"button\\\"\"), \" instead of. \"), mdx(\"li\", {\n    parentName: \"ul\"\n  }, \"Deprecated property \", mdx(\"inlineCode\", {\n    parentName: \"li\"\n  }, \"innerRef\"), \".\"), mdx(\"li\", {\n    parentName: \"ul\"\n  }, \"Deprecated property \", mdx(\"inlineCode\", {\n    parentName: \"li\"\n  }, \"tag\"), \", use \", mdx(\"inlineCode\", {\n    parentName: \"li\"\n  }, \"component\"), \" instead of.\")), mdx(\"h3\", {\n    \"id\": \"cmedia\",\n    \"style\": {\n      \"position\": \"relative\"\n    }\n  }, \"CMedia\", mdx(\"a\", {\n    parentName: \"h3\",\n    \"href\": \"#cmedia\",\n    \"aria-label\": \"cmedia permalink\",\n    \"className\": \"anchor-link after\"\n  }, mdx(\"span\", {\n    parentName: \"a\"\n  }, \"#\"))), mdx(\"ul\", null, mdx(\"li\", {\n    parentName: \"ul\"\n  }, \"Component is depracated.\")), mdx(\"h3\", {\n    \"id\": \"cmodal\",\n    \"style\": {\n      \"position\": \"relative\"\n    }\n  }, \"CModal\", mdx(\"a\", {\n    parentName: \"h3\",\n    \"href\": \"#cmodal\",\n    \"aria-label\": \"cmodal permalink\",\n    \"className\": \"anchor-link after\"\n  }, mdx(\"span\", {\n    parentName: \"a\"\n  }, \"#\"))), mdx(\"ul\", null, mdx(\"li\", {\n    parentName: \"ul\"\n  }, \"Deprecated property \", mdx(\"inlineCode\", {\n    parentName: \"li\"\n  }, \"addContentClass\"), \".\"), mdx(\"li\", {\n    parentName: \"ul\"\n  }, \"Deprecated property \", mdx(\"inlineCode\", {\n    parentName: \"li\"\n  }, \"borderColor\"), \", use utilities \", mdx(\"inlineCode\", {\n    parentName: \"li\"\n  }, \"className=\\\"border border-{#color}\\\"\"), \" instead of.\"), mdx(\"li\", {\n    parentName: \"ul\"\n  }, \"Deprecated property \", mdx(\"inlineCode\", {\n    parentName: \"li\"\n  }, \"centered\"), \".\"), mdx(\"li\", {\n    parentName: \"ul\"\n  }, \"Deprecated property \", mdx(\"inlineCode\", {\n    parentName: \"li\"\n  }, \"closeOnBackdrop\"), \".\"), mdx(\"li\", {\n    parentName: \"ul\"\n  }, \"Deprecated property \", mdx(\"inlineCode\", {\n    parentName: \"li\"\n  }, \"fade\"), \", use \", mdx(\"inlineCode\", {\n    parentName: \"li\"\n  }, \"transition\"), \" instead of.\"), mdx(\"li\", {\n    parentName: \"ul\"\n  }, \"Deprecated property \", mdx(\"inlineCode\", {\n    parentName: \"li\"\n  }, \"innerRef\"), \".\"), mdx(\"li\", {\n    parentName: \"ul\"\n  }, \"Deprecated property \", mdx(\"inlineCode\", {\n    parentName: \"li\"\n  }, \"onClosed\"), \".\"), mdx(\"li\", {\n    parentName: \"ul\"\n  }, \"Deprecated property \", mdx(\"inlineCode\", {\n    parentName: \"li\"\n  }, \"onOpened\"), \".\"), mdx(\"li\", {\n    parentName: \"ul\"\n  }, \"Deprecated property \", mdx(\"inlineCode\", {\n    parentName: \"li\"\n  }, \"show\"), \", use \", mdx(\"inlineCode\", {\n    parentName: \"li\"\n  }, \"visible\"), \" instead of.\")), mdx(\"h4\", {\n    \"id\": \"cmodalbody\",\n    \"style\": {\n      \"position\": \"relative\"\n    }\n  }, \"CModalBody\", mdx(\"a\", {\n    parentName: \"h4\",\n    \"href\": \"#cmodalbody\",\n    \"aria-label\": \"cmodalbody permalink\",\n    \"className\": \"anchor-link after\"\n  }, mdx(\"span\", {\n    parentName: \"a\"\n  }, \"#\"))), mdx(\"ul\", null, mdx(\"li\", {\n    parentName: \"ul\"\n  }, \"Deprecated property \", mdx(\"inlineCode\", {\n    parentName: \"li\"\n  }, \"innerRef\"), \".\"), mdx(\"li\", {\n    parentName: \"ul\"\n  }, \"Deprecated property \", mdx(\"inlineCode\", {\n    parentName: \"li\"\n  }, \"tag\"), \".\")), mdx(\"h4\", {\n    \"id\": \"cmodalfooter\",\n    \"style\": {\n      \"position\": \"relative\"\n    }\n  }, \"CModalFooter\", mdx(\"a\", {\n    parentName: \"h4\",\n    \"href\": \"#cmodalfooter\",\n    \"aria-label\": \"cmodalfooter permalink\",\n    \"className\": \"anchor-link after\"\n  }, mdx(\"span\", {\n    parentName: \"a\"\n  }, \"#\"))), mdx(\"ul\", null, mdx(\"li\", {\n    parentName: \"ul\"\n  }, \"Deprecated property \", mdx(\"inlineCode\", {\n    parentName: \"li\"\n  }, \"innerRef\"), \".\"), mdx(\"li\", {\n    parentName: \"ul\"\n  }, \"Deprecated property \", mdx(\"inlineCode\", {\n    parentName: \"li\"\n  }, \"tag\"), \".\")), mdx(\"h4\", {\n    \"id\": \"cmodalheader\",\n    \"style\": {\n      \"position\": \"relative\"\n    }\n  }, \"CModalHeader\", mdx(\"a\", {\n    parentName: \"h4\",\n    \"href\": \"#cmodalheader\",\n    \"aria-label\": \"cmodalheader permalink\",\n    \"className\": \"anchor-link after\"\n  }, mdx(\"span\", {\n    parentName: \"a\"\n  }, \"#\"))), mdx(\"ul\", null, mdx(\"li\", {\n    parentName: \"ul\"\n  }, \"Deprecated property \", mdx(\"inlineCode\", {\n    parentName: \"li\"\n  }, \"innerRef\"), \".\"), mdx(\"li\", {\n    parentName: \"ul\"\n  }, \"Deprecated property \", mdx(\"inlineCode\", {\n    parentName: \"li\"\n  }, \"tag\"), \".\")), mdx(\"h3\", {\n    \"id\": \"cnav\",\n    \"style\": {\n      \"position\": \"relative\"\n    }\n  }, \"CNav\", mdx(\"a\", {\n    parentName: \"h3\",\n    \"href\": \"#cnav\",\n    \"aria-label\": \"cnav permalink\",\n    \"className\": \"anchor-link after\"\n  }, mdx(\"span\", {\n    parentName: \"a\"\n  }, \"#\"))), mdx(\"ul\", null, mdx(\"li\", {\n    parentName: \"ul\"\n  }, \"Deprecated property \", mdx(\"inlineCode\", {\n    parentName: \"li\"\n  }, \"inCard\"), \".\"), mdx(\"li\", {\n    parentName: \"ul\"\n  }, \"Deprecated property \", mdx(\"inlineCode\", {\n    parentName: \"li\"\n  }, \"innerRef\"), \".\"), mdx(\"li\", {\n    parentName: \"ul\"\n  }, \"Deprecated property \", mdx(\"inlineCode\", {\n    parentName: \"li\"\n  }, \"fill\"), \", use \", mdx(\"inlineCode\", {\n    parentName: \"li\"\n  }, \"layout=\\\"fill\\\"\"), \" instead of.\"), mdx(\"li\", {\n    parentName: \"ul\"\n  }, \"Deprecated property \", mdx(\"inlineCode\", {\n    parentName: \"li\"\n  }, \"justified\"), \", use \", mdx(\"inlineCode\", {\n    parentName: \"li\"\n  }, \"layout=\\\"justified\\\"\"), \" instead of.\"), mdx(\"li\", {\n    parentName: \"ul\"\n  }, \"Deprecated property \", mdx(\"inlineCode\", {\n    parentName: \"li\"\n  }, \"tag\"), \", use \", mdx(\"inlineCode\", {\n    parentName: \"li\"\n  }, \"component\"), \" instead of.\")), mdx(\"h4\", {\n    \"id\": \"cnavitem\",\n    \"style\": {\n      \"position\": \"relative\"\n    }\n  }, \"CNavItem\", mdx(\"a\", {\n    parentName: \"h4\",\n    \"href\": \"#cnavitem\",\n    \"aria-label\": \"cnavitem permalink\",\n    \"className\": \"anchor-link after\"\n  }, mdx(\"span\", {\n    parentName: \"a\"\n  }, \"#\"))), mdx(\"ul\", null, mdx(\"li\", {\n    parentName: \"ul\"\n  }, \"Deprecated property \", mdx(\"inlineCode\", {\n    parentName: \"li\"\n  }, \"innerRef\"), \".\"), mdx(\"li\", {\n    parentName: \"ul\"\n  }, \"Deprecated property \", mdx(\"inlineCode\", {\n    parentName: \"li\"\n  }, \"tag\"), \", use \", mdx(\"inlineCode\", {\n    parentName: \"li\"\n  }, \"component\"), \" instead of.\")), mdx(\"h4\", {\n    \"id\": \"cnavlink\",\n    \"style\": {\n      \"position\": \"relative\"\n    }\n  }, \"CNavLink\", mdx(\"a\", {\n    parentName: \"h4\",\n    \"href\": \"#cnavlink\",\n    \"aria-label\": \"cnavlink permalink\",\n    \"className\": \"anchor-link after\"\n  }, mdx(\"span\", {\n    parentName: \"a\"\n  }, \"#\"))), mdx(\"ul\", null, mdx(\"li\", {\n    parentName: \"ul\"\n  }, \"Deprecated property \", mdx(\"inlineCode\", {\n    parentName: \"li\"\n  }, \"innerRef\"), \".\")), mdx(\"h3\", {\n    \"id\": \"cnavbar\",\n    \"style\": {\n      \"position\": \"relative\"\n    }\n  }, \"CNavbar\", mdx(\"a\", {\n    parentName: \"h3\",\n    \"href\": \"#cnavbar\",\n    \"aria-label\": \"cnavbar permalink\",\n    \"className\": \"anchor-link after\"\n  }, mdx(\"span\", {\n    parentName: \"a\"\n  }, \"#\"))), mdx(\"ul\", null, mdx(\"li\", {\n    parentName: \"ul\"\n  }, \"Deprecated property \", mdx(\"inlineCode\", {\n    parentName: \"li\"\n  }, \"expandable\"), \", use \", mdx(\"inlineCode\", {\n    parentName: \"li\"\n  }, \"expand\"), \" instead of.\"), mdx(\"li\", {\n    parentName: \"ul\"\n  }, \"Deprecated property \", mdx(\"inlineCode\", {\n    parentName: \"li\"\n  }, \"fixed\"), \", use \", mdx(\"inlineCode\", {\n    parentName: \"li\"\n  }, \"placement=\\\"fixed-top\\\"\"), \" instead of.\"), mdx(\"li\", {\n    parentName: \"ul\"\n  }, \"Deprecated property \", mdx(\"inlineCode\", {\n    parentName: \"li\"\n  }, \"innerRef\"), \".\"), mdx(\"li\", {\n    parentName: \"ul\"\n  }, \"Deprecated property \", mdx(\"inlineCode\", {\n    parentName: \"li\"\n  }, \"light\"), \", use \", mdx(\"inlineCode\", {\n    parentName: \"li\"\n  }, \"colorScheme=\\\"light\\\"\"), \" instead of.\"), mdx(\"li\", {\n    parentName: \"ul\"\n  }, \"Deprecated property \", mdx(\"inlineCode\", {\n    parentName: \"li\"\n  }, \"sticky\"), \", use \", mdx(\"inlineCode\", {\n    parentName: \"li\"\n  }, \"placement=\\\"sticky-top\\\"\"), \" instead of.\"), mdx(\"li\", {\n    parentName: \"ul\"\n  }, \"Deprecated property \", mdx(\"inlineCode\", {\n    parentName: \"li\"\n  }, \"tag\"), \", use \", mdx(\"inlineCode\", {\n    parentName: \"li\"\n  }, \"component\"), \" instead of.\")), mdx(\"h4\", {\n    \"id\": \"cnavbarnav\",\n    \"style\": {\n      \"position\": \"relative\"\n    }\n  }, \"CNavbarNav\", mdx(\"a\", {\n    parentName: \"h4\",\n    \"href\": \"#cnavbarnav\",\n    \"aria-label\": \"cnavbarnav permalink\",\n    \"className\": \"anchor-link after\"\n  }, mdx(\"span\", {\n    parentName: \"a\"\n  }, \"#\"))), mdx(\"ul\", null, mdx(\"li\", {\n    parentName: \"ul\"\n  }, \"Deprecated property \", mdx(\"inlineCode\", {\n    parentName: \"li\"\n  }, \"innerRef\"), \".\"), mdx(\"li\", {\n    parentName: \"ul\"\n  }, \"Deprecated property \", mdx(\"inlineCode\", {\n    parentName: \"li\"\n  }, \"tag\"), \", use \", mdx(\"inlineCode\", {\n    parentName: \"li\"\n  }, \"component\"), \" instead of.\")), mdx(\"h4\", {\n    \"id\": \"cnavbartext\",\n    \"style\": {\n      \"position\": \"relative\"\n    }\n  }, \"CNavbarText\", mdx(\"a\", {\n    parentName: \"h4\",\n    \"href\": \"#cnavbartext\",\n    \"aria-label\": \"cnavbartext permalink\",\n    \"className\": \"anchor-link after\"\n  }, mdx(\"span\", {\n    parentName: \"a\"\n  }, \"#\"))), mdx(\"ul\", null, mdx(\"li\", {\n    parentName: \"ul\"\n  }, \"Deprecated property \", mdx(\"inlineCode\", {\n    parentName: \"li\"\n  }, \"innerRef\"), \".\"), mdx(\"li\", {\n    parentName: \"ul\"\n  }, \"Deprecated property \", mdx(\"inlineCode\", {\n    parentName: \"li\"\n  }, \"tag\"), \", use \", mdx(\"inlineCode\", {\n    parentName: \"li\"\n  }, \"component\"), \" instead of.\")), mdx(\"h3\", {\n    \"id\": \"cpagination\",\n    \"style\": {\n      \"position\": \"relative\"\n    }\n  }, \"CPagination\", mdx(\"a\", {\n    parentName: \"h3\",\n    \"href\": \"#cpagination\",\n    \"aria-label\": \"cpagination permalink\",\n    \"className\": \"anchor-link after\"\n  }, mdx(\"span\", {\n    parentName: \"a\"\n  }, \"#\"))), mdx(\"ul\", null, mdx(\"li\", {\n    parentName: \"ul\"\n  }, \"**The component has been split into \", mdx(\"inlineCode\", {\n    parentName: \"li\"\n  }, \"CPagination\"), \" and to \", mdx(\"inlineCode\", {\n    parentName: \"li\"\n  }, \"CSmartPagination\"), \" components.\")), mdx(\"h3\", {\n    \"id\": \"cpopover\",\n    \"style\": {\n      \"position\": \"relative\"\n    }\n  }, \"CPopover\", mdx(\"a\", {\n    parentName: \"h3\",\n    \"href\": \"#cpopover\",\n    \"aria-label\": \"cpopover permalink\",\n    \"className\": \"anchor-link after\"\n  }, mdx(\"span\", {\n    parentName: \"a\"\n  }, \"#\"))), mdx(\"ul\", null, mdx(\"li\", {\n    parentName: \"ul\"\n  }, \"Deprecated property \", mdx(\"inlineCode\", {\n    parentName: \"li\"\n  }, \"header\"), \", use \", mdx(\"inlineCode\", {\n    parentName: \"li\"\n  }, \"title\"), \" instead of.\")), mdx(\"h3\", {\n    \"id\": \"cprogress\",\n    \"style\": {\n      \"position\": \"relative\"\n    }\n  }, \"CProgress\", mdx(\"a\", {\n    parentName: \"h3\",\n    \"href\": \"#cprogress\",\n    \"aria-label\": \"cprogress permalink\",\n    \"className\": \"anchor-link after\"\n  }, mdx(\"span\", {\n    parentName: \"a\"\n  }, \"#\"))), mdx(\"ul\", null, mdx(\"li\", {\n    parentName: \"ul\"\n  }, \"Deprecated property \", mdx(\"inlineCode\", {\n    parentName: \"li\"\n  }, \"innerRef\"), \".\"), mdx(\"li\", {\n    parentName: \"ul\"\n  }, \"Deprecated property \", mdx(\"inlineCode\", {\n    parentName: \"li\"\n  }, \"max\"), \".\"), mdx(\"li\", {\n    parentName: \"ul\"\n  }, \"Deprecated property \", mdx(\"inlineCode\", {\n    parentName: \"li\"\n  }, \"precision\"), \".\"), mdx(\"li\", {\n    parentName: \"ul\"\n  }, \"Deprecated property \", mdx(\"inlineCode\", {\n    parentName: \"li\"\n  }, \"showPercentage\"), \".\"), mdx(\"li\", {\n    parentName: \"ul\"\n  }, \"Deprecated property \", mdx(\"inlineCode\", {\n    parentName: \"li\"\n  }, \"showValue\"), \".\"), mdx(\"li\", {\n    parentName: \"ul\"\n  }, \"Deprecated property \", mdx(\"inlineCode\", {\n    parentName: \"li\"\n  }, \"size\"), \", use \", mdx(\"inlineCode\", {\n    parentName: \"li\"\n  }, \"height\"), \" instead of.\"), mdx(\"li\", {\n    parentName: \"ul\"\n  }, \"Deprecated property \", mdx(\"inlineCode\", {\n    parentName: \"li\"\n  }, \"striped\"), \", use \", mdx(\"inlineCode\", {\n    parentName: \"li\"\n  }, \"variant=\\\"striped\\\"\"), \" instead of.\")), mdx(\"h3\", {\n    \"id\": \"cprogressbar\",\n    \"style\": {\n      \"position\": \"relative\"\n    }\n  }, \"CProgressBar\", mdx(\"a\", {\n    parentName: \"h3\",\n    \"href\": \"#cprogressbar\",\n    \"aria-label\": \"cprogressbar permalink\",\n    \"className\": \"anchor-link after\"\n  }, mdx(\"span\", {\n    parentName: \"a\"\n  }, \"#\"))), mdx(\"ul\", null, mdx(\"li\", {\n    parentName: \"ul\"\n  }, \"Deprecated property \", mdx(\"inlineCode\", {\n    parentName: \"li\"\n  }, \"innerRef\"), \".\"), mdx(\"li\", {\n    parentName: \"ul\"\n  }, \"Deprecated property \", mdx(\"inlineCode\", {\n    parentName: \"li\"\n  }, \"max\"), \".\"), mdx(\"li\", {\n    parentName: \"ul\"\n  }, \"Deprecated property \", mdx(\"inlineCode\", {\n    parentName: \"li\"\n  }, \"precision\"), \".\"), mdx(\"li\", {\n    parentName: \"ul\"\n  }, \"Deprecated property \", mdx(\"inlineCode\", {\n    parentName: \"li\"\n  }, \"showPercentage\"), \".\"), mdx(\"li\", {\n    parentName: \"ul\"\n  }, \"Deprecated property \", mdx(\"inlineCode\", {\n    parentName: \"li\"\n  }, \"showValue\"), \".\"), mdx(\"li\", {\n    parentName: \"ul\"\n  }, \"Deprecated property \", mdx(\"inlineCode\", {\n    parentName: \"li\"\n  }, \"size\"), \", use \", mdx(\"inlineCode\", {\n    parentName: \"li\"\n  }, \"height\"), \" instead of.\"), mdx(\"li\", {\n    parentName: \"ul\"\n  }, \"Deprecated property \", mdx(\"inlineCode\", {\n    parentName: \"li\"\n  }, \"striped\"), \", use \", mdx(\"inlineCode\", {\n    parentName: \"li\"\n  }, \"variant=\\\"striped\\\"\"), \" instead of.\")), mdx(\"h3\", {\n    \"id\": \"csidebar\",\n    \"style\": {\n      \"position\": \"relative\"\n    }\n  }, \"CSidebar\", mdx(\"a\", {\n    parentName: \"h3\",\n    \"href\": \"#csidebar\",\n    \"aria-label\": \"csidebar permalink\",\n    \"className\": \"anchor-link after\"\n  }, mdx(\"span\", {\n    parentName: \"a\"\n  }, \"#\"))), mdx(\"ul\", null, mdx(\"li\", {\n    parentName: \"ul\"\n  }, \"Deprecated property \", mdx(\"inlineCode\", {\n    parentName: \"li\"\n  }, \"minimize\"), \" use \", mdx(\"inlineCode\", {\n    parentName: \"li\"\n  }, \"narrow\"), \" instead of.\"), mdx(\"li\", {\n    parentName: \"ul\"\n  }, \"Deprecated property \", mdx(\"inlineCode\", {\n    parentName: \"li\"\n  }, \"dropdownMode\"), \".\"), mdx(\"li\", {\n    parentName: \"ul\"\n  }, \"Deprecated component \", mdx(\"inlineCode\", {\n    parentName: \"li\"\n  }, \"CSidebarForm\"), \", use \", mdx(\"inlineCode\", {\n    parentName: \"li\"\n  }, \"CForm\"), \" instead of.\"), mdx(\"li\", {\n    parentName: \"ul\"\n  }, \"Deprecated component \", mdx(\"inlineCode\", {\n    parentName: \"li\"\n  }, \"CSidebarNavDivider\"), \", use \", mdx(\"inlineCode\", {\n    parentName: \"li\"\n  }, \"CNavDivider\"), \" instead of.\"), mdx(\"li\", {\n    parentName: \"ul\"\n  }, \"Deprecated component \", mdx(\"inlineCode\", {\n    parentName: \"li\"\n  }, \"CSidebarNavDropdown\"), \", use \", mdx(\"inlineCode\", {\n    parentName: \"li\"\n  }, \"CNavGroup\"), \" instead of.\"), mdx(\"li\", {\n    parentName: \"ul\"\n  }, \"Deprecated component \", mdx(\"inlineCode\", {\n    parentName: \"li\"\n  }, \"CSidebarNavLink\"), \", use \", mdx(\"inlineCode\", {\n    parentName: \"li\"\n  }, \"CNavLink\"), \" instead of.\"), mdx(\"li\", {\n    parentName: \"ul\"\n  }, \"Deprecated component \", mdx(\"inlineCode\", {\n    parentName: \"li\"\n  }, \"CSidebarNavItem\"), \", use \", mdx(\"inlineCode\", {\n    parentName: \"li\"\n  }, \"CNavItem\"), \" instead of.\"), mdx(\"li\", {\n    parentName: \"ul\"\n  }, \"Deprecated component \", mdx(\"inlineCode\", {\n    parentName: \"li\"\n  }, \"CSidebarNavTitile\"), \", use \", mdx(\"inlineCode\", {\n    parentName: \"li\"\n  }, \"CNavTitle\"), \" instead of.\")), mdx(\"h3\", {\n    \"id\": \"cswitch\",\n    \"style\": {\n      \"position\": \"relative\"\n    }\n  }, \"CSwitch\", mdx(\"a\", {\n    parentName: \"h3\",\n    \"href\": \"#cswitch\",\n    \"aria-label\": \"cswitch permalink\",\n    \"className\": \"anchor-link after\"\n  }, mdx(\"span\", {\n    parentName: \"a\"\n  }, \"#\"))), mdx(\"ul\", null, mdx(\"li\", {\n    parentName: \"ul\"\n  }, \"Component is depracated, use \", mdx(\"inlineCode\", {\n    parentName: \"li\"\n  }, \"CFormSwitch\"), \" instead of.\")), mdx(\"h3\", {\n    \"id\": \"cspinner\",\n    \"style\": {\n      \"position\": \"relative\"\n    }\n  }, \"CSpinner\", mdx(\"a\", {\n    parentName: \"h3\",\n    \"href\": \"#cspinner\",\n    \"aria-label\": \"cspinner permalink\",\n    \"className\": \"anchor-link after\"\n  }, mdx(\"span\", {\n    parentName: \"a\"\n  }, \"#\"))), mdx(\"ul\", null, mdx(\"li\", {\n    parentName: \"ul\"\n  }, \"Deprecated property \", mdx(\"inlineCode\", {\n    parentName: \"li\"\n  }, \"innerRef\"), \".\"), mdx(\"li\", {\n    parentName: \"ul\"\n  }, \"Deprecated property \", mdx(\"inlineCode\", {\n    parentName: \"li\"\n  }, \"grow\"), \", use \", mdx(\"inlineCode\", {\n    parentName: \"li\"\n  }, \"variant=\\\"grow\\\"\"), \" instead of.\"), mdx(\"li\", {\n    parentName: \"ul\"\n  }, \"Deprecated property \", mdx(\"inlineCode\", {\n    parentName: \"li\"\n  }, \"tag\"), \", use \", mdx(\"inlineCode\", {\n    parentName: \"li\"\n  }, \"component\"), \" instead of.\")), mdx(\"h3\", {\n    \"id\": \"ctabs\",\n    \"style\": {\n      \"position\": \"relative\"\n    }\n  }, \"CTabs\", mdx(\"a\", {\n    parentName: \"h3\",\n    \"href\": \"#ctabs\",\n    \"aria-label\": \"ctabs permalink\",\n    \"className\": \"anchor-link after\"\n  }, mdx(\"span\", {\n    parentName: \"a\"\n  }, \"#\"))), mdx(\"ul\", null, mdx(\"li\", {\n    parentName: \"ul\"\n  }, \"Component is depracated, use \", mdx(\"inlineCode\", {\n    parentName: \"li\"\n  }, \"<CNav variant=\\\"tabs\\\" role=\\\"tablist\\\">\"), \" instead of\")), mdx(\"h4\", {\n    \"id\": \"ctabcontent\",\n    \"style\": {\n      \"position\": \"relative\"\n    }\n  }, \"CTabContent\", mdx(\"a\", {\n    parentName: \"h4\",\n    \"href\": \"#ctabcontent\",\n    \"aria-label\": \"ctabcontent permalink\",\n    \"className\": \"anchor-link after\"\n  }, mdx(\"span\", {\n    parentName: \"a\"\n  }, \"#\"))), mdx(\"ul\", null, mdx(\"li\", {\n    parentName: \"ul\"\n  }, \"Deprecated property \", mdx(\"inlineCode\", {\n    parentName: \"li\"\n  }, \"innerRef\"), \".\"), mdx(\"li\", {\n    parentName: \"ul\"\n  }, \"Deprecated property \", mdx(\"inlineCode\", {\n    parentName: \"li\"\n  }, \"fade\"), \".\")), mdx(\"h4\", {\n    \"id\": \"ctabpane\",\n    \"style\": {\n      \"position\": \"relative\"\n    }\n  }, \"CTabPane\", mdx(\"a\", {\n    parentName: \"h4\",\n    \"href\": \"#ctabpane\",\n    \"aria-label\": \"ctabpane permalink\",\n    \"className\": \"anchor-link after\"\n  }, mdx(\"span\", {\n    parentName: \"a\"\n  }, \"#\"))), mdx(\"ul\", null, mdx(\"li\", {\n    parentName: \"ul\"\n  }, \"Deprecated property \", mdx(\"inlineCode\", {\n    parentName: \"li\"\n  }, \"active\"), \", use \", mdx(\"inlineCode\", {\n    parentName: \"li\"\n  }, \"visible\"), \" instead of.\"), mdx(\"li\", {\n    parentName: \"ul\"\n  }, \"Deprecated property \", mdx(\"inlineCode\", {\n    parentName: \"li\"\n  }, \"innerRef\"), \".\")), mdx(\"h3\", {\n    \"id\": \"ctoast\",\n    \"style\": {\n      \"position\": \"relative\"\n    }\n  }, \"CToast\", mdx(\"a\", {\n    parentName: \"h3\",\n    \"href\": \"#ctoast\",\n    \"aria-label\": \"ctoast permalink\",\n    \"className\": \"anchor-link after\"\n  }, mdx(\"span\", {\n    parentName: \"a\"\n  }, \"#\"))), mdx(\"ul\", null, mdx(\"li\", {\n    parentName: \"ul\"\n  }, \"Deprecated property \", mdx(\"inlineCode\", {\n    parentName: \"li\"\n  }, \"innerRef\"), \".\"), mdx(\"li\", {\n    parentName: \"ul\"\n  }, \"Deprecated property \", mdx(\"inlineCode\", {\n    parentName: \"li\"\n  }, \"fade\"), \", use \", mdx(\"inlineCode\", {\n    parentName: \"li\"\n  }, \"animation\"), \" instead of.\"), mdx(\"li\", {\n    parentName: \"ul\"\n  }, \"Deprecated property \", mdx(\"inlineCode\", {\n    parentName: \"li\"\n  }, \"show\"), \", use \", mdx(\"inlineCode\", {\n    parentName: \"li\"\n  }, \"visible\"), \" instead of.\"), mdx(\"li\", {\n    parentName: \"ul\"\n  }, \"Deprecated property \", mdx(\"inlineCode\", {\n    parentName: \"li\"\n  }, \"onStateChange\"), \".\")), mdx(\"h4\", {\n    \"id\": \"ctoastbody\",\n    \"style\": {\n      \"position\": \"relative\"\n    }\n  }, \"CToastBody\", mdx(\"a\", {\n    parentName: \"h4\",\n    \"href\": \"#ctoastbody\",\n    \"aria-label\": \"ctoastbody permalink\",\n    \"className\": \"anchor-link after\"\n  }, mdx(\"span\", {\n    parentName: \"a\"\n  }, \"#\"))), mdx(\"ul\", null, mdx(\"li\", {\n    parentName: \"ul\"\n  }, \"Deprecated property \", mdx(\"inlineCode\", {\n    parentName: \"li\"\n  }, \"innerRef\"), \".\")), mdx(\"h4\", {\n    \"id\": \"ctoastheader\",\n    \"style\": {\n      \"position\": \"relative\"\n    }\n  }, \"CToastHeader\", mdx(\"a\", {\n    parentName: \"h4\",\n    \"href\": \"#ctoastheader\",\n    \"aria-label\": \"ctoastheader permalink\",\n    \"className\": \"anchor-link after\"\n  }, mdx(\"span\", {\n    parentName: \"a\"\n  }, \"#\"))), mdx(\"ul\", null, mdx(\"li\", {\n    parentName: \"ul\"\n  }, \"Deprecated property \", mdx(\"inlineCode\", {\n    parentName: \"li\"\n  }, \"innerRef\"), \".\")), mdx(\"h3\", {\n    \"id\": \"ctoggler\",\n    \"style\": {\n      \"position\": \"relative\"\n    }\n  }, \"CToggler\", mdx(\"a\", {\n    parentName: \"h3\",\n    \"href\": \"#ctoggler\",\n    \"aria-label\": \"ctoggler permalink\",\n    \"className\": \"anchor-link after\"\n  }, mdx(\"span\", {\n    parentName: \"a\"\n  }, \"#\"))), mdx(\"ul\", null, mdx(\"li\", {\n    parentName: \"ul\"\n  }, \"Component is depracated.\")), mdx(\"h3\", {\n    \"id\": \"ctooltip\",\n    \"style\": {\n      \"position\": \"relative\"\n    }\n  }, \"CTooltip\", mdx(\"a\", {\n    parentName: \"h3\",\n    \"href\": \"#ctooltip\",\n    \"aria-label\": \"ctooltip permalink\",\n    \"className\": \"anchor-link after\"\n  }, mdx(\"span\", {\n    parentName: \"a\"\n  }, \"#\"))), mdx(\"ul\", null, mdx(\"li\", {\n    parentName: \"ul\"\n  }, \"Deprecated property \", mdx(\"inlineCode\", {\n    parentName: \"li\"\n  }, \"interactive\"), \".\"), mdx(\"li\", {\n    parentName: \"ul\"\n  }, \"Deprecated property \", mdx(\"inlineCode\", {\n    parentName: \"li\"\n  }, \"advancedOptions\"), \".\")), mdx(\"h2\", {\n    \"id\": \"forms\",\n    \"style\": {\n      \"position\": \"relative\"\n    }\n  }, \"Forms\", mdx(\"a\", {\n    parentName: \"h2\",\n    \"href\": \"#forms\",\n    \"aria-label\": \"forms permalink\",\n    \"className\": \"anchor-link after\"\n  }, mdx(\"span\", {\n    parentName: \"a\"\n  }, \"#\"))), mdx(\"h3\", {\n    \"id\": \"cformgroup\",\n    \"style\": {\n      \"position\": \"relative\"\n    }\n  }, \"CFormGroup\", mdx(\"a\", {\n    parentName: \"h3\",\n    \"href\": \"#cformgroup\",\n    \"aria-label\": \"cformgroup permalink\",\n    \"className\": \"anchor-link after\"\n  }, mdx(\"span\", {\n    parentName: \"a\"\n  }, \"#\"))), mdx(\"ul\", null, mdx(\"li\", {\n    parentName: \"ul\"\n  }, \"Component is depracated.\")), mdx(\"h3\", {\n    \"id\": \"cinput\",\n    \"style\": {\n      \"position\": \"relative\"\n    }\n  }, \"CInput\", mdx(\"a\", {\n    parentName: \"h3\",\n    \"href\": \"#cinput\",\n    \"aria-label\": \"cinput permalink\",\n    \"className\": \"anchor-link after\"\n  }, mdx(\"span\", {\n    parentName: \"a\"\n  }, \"#\"))), mdx(\"ul\", null, mdx(\"li\", {\n    parentName: \"ul\"\n  }, mdx(\"strong\", {\n    parentName: \"li\"\n  }, \"Component renamed to \", mdx(\"inlineCode\", {\n    parentName: \"strong\"\n  }, \"CFormInput\"))), mdx(\"li\", {\n    parentName: \"ul\"\n  }, \"Deprecated property \", mdx(\"inlineCode\", {\n    parentName: \"li\"\n  }, \"plaintext\"), \", use \", mdx(\"inlineCode\", {\n    parentName: \"li\"\n  }, \"plainText\"), \" instead of.\")), mdx(\"h3\", {\n    \"id\": \"cinputcheckbox\",\n    \"style\": {\n      \"position\": \"relative\"\n    }\n  }, \"CInputCheckbox\", mdx(\"a\", {\n    parentName: \"h3\",\n    \"href\": \"#cinputcheckbox\",\n    \"aria-label\": \"cinputcheckbox permalink\",\n    \"className\": \"anchor-link after\"\n  }, mdx(\"span\", {\n    parentName: \"a\"\n  }, \"#\"))), mdx(\"ul\", null, mdx(\"li\", {\n    parentName: \"ul\"\n  }, \"Component is depracated, use \", mdx(\"inlineCode\", {\n    parentName: \"li\"\n  }, \"<CFormCheck>\"), \" instead of.\")), mdx(\"h3\", {\n    \"id\": \"cinputfile\",\n    \"style\": {\n      \"position\": \"relative\"\n    }\n  }, \"CInputFile\", mdx(\"a\", {\n    parentName: \"h3\",\n    \"href\": \"#cinputfile\",\n    \"aria-label\": \"cinputfile permalink\",\n    \"className\": \"anchor-link after\"\n  }, mdx(\"span\", {\n    parentName: \"a\"\n  }, \"#\"))), mdx(\"ul\", null, mdx(\"li\", {\n    parentName: \"ul\"\n  }, \"Component is depracated, use \", mdx(\"inlineCode\", {\n    parentName: \"li\"\n  }, \"<CFormInput type=\\\"file\\\">\"), \" instead of.\")), mdx(\"h3\", {\n    \"id\": \"cinputradio\",\n    \"style\": {\n      \"position\": \"relative\"\n    }\n  }, \"CInputRadio\", mdx(\"a\", {\n    parentName: \"h3\",\n    \"href\": \"#cinputradio\",\n    \"aria-label\": \"cinputradio permalink\",\n    \"className\": \"anchor-link after\"\n  }, mdx(\"span\", {\n    parentName: \"a\"\n  }, \"#\"))), mdx(\"ul\", null, mdx(\"li\", {\n    parentName: \"ul\"\n  }, \"Component is depracated, use \", mdx(\"inlineCode\", {\n    parentName: \"li\"\n  }, \"<CFormCheck type=\\\"radio\\\">\"), \" instead of.\")), mdx(\"h3\", {\n    \"id\": \"cinputgroup\",\n    \"style\": {\n      \"position\": \"relative\"\n    }\n  }, \"CInputGroup\", mdx(\"a\", {\n    parentName: \"h3\",\n    \"href\": \"#cinputgroup\",\n    \"aria-label\": \"cinputgroup permalink\",\n    \"className\": \"anchor-link after\"\n  }, mdx(\"span\", {\n    parentName: \"a\"\n  }, \"#\"))), mdx(\"ul\", null, mdx(\"li\", {\n    parentName: \"ul\"\n  }, \"Deprecated property \", mdx(\"inlineCode\", {\n    parentName: \"li\"\n  }, \"innerRef\"), \".\")), mdx(\"h4\", {\n    \"id\": \"cinputgroupaddon\",\n    \"style\": {\n      \"position\": \"relative\"\n    }\n  }, \"CInputGroupAddon\", mdx(\"a\", {\n    parentName: \"h4\",\n    \"href\": \"#cinputgroupaddon\",\n    \"aria-label\": \"cinputgroupaddon permalink\",\n    \"className\": \"anchor-link after\"\n  }, mdx(\"span\", {\n    parentName: \"a\"\n  }, \"#\"))), mdx(\"ul\", null, mdx(\"li\", {\n    parentName: \"ul\"\n  }, \"Component is depracated, use \", mdx(\"inlineCode\", {\n    parentName: \"li\"\n  }, \"CInputGroupText\"), \" instead of.\")), mdx(\"h3\", {\n    \"id\": \"cselect\",\n    \"style\": {\n      \"position\": \"relative\"\n    }\n  }, \"CSelect\", mdx(\"a\", {\n    parentName: \"h3\",\n    \"href\": \"#cselect\",\n    \"aria-label\": \"cselect permalink\",\n    \"className\": \"anchor-link after\"\n  }, mdx(\"span\", {\n    parentName: \"a\"\n  }, \"#\"))), mdx(\"ul\", null, mdx(\"li\", {\n    parentName: \"ul\"\n  }, \"Component is depracated, use \", mdx(\"inlineCode\", {\n    parentName: \"li\"\n  }, \"<CFormSelect>\"), \" instead of.\")), mdx(\"h3\", {\n    \"id\": \"cvalidfeedback\",\n    \"style\": {\n      \"position\": \"relative\"\n    }\n  }, \"CValidFeedback\", mdx(\"a\", {\n    parentName: \"h3\",\n    \"href\": \"#cvalidfeedback\",\n    \"aria-label\": \"cvalidfeedback permalink\",\n    \"className\": \"anchor-link after\"\n  }, mdx(\"span\", {\n    parentName: \"a\"\n  }, \"#\"))), mdx(\"ul\", null, mdx(\"li\", {\n    parentName: \"ul\"\n  }, \"Component is depracated, use \", mdx(\"inlineCode\", {\n    parentName: \"li\"\n  }, \"<CFormFeedback valid>\"), \" instead of.\")), mdx(\"h3\", {\n    \"id\": \"cinvalidfeedback\",\n    \"style\": {\n      \"position\": \"relative\"\n    }\n  }, \"CInvalidFeedback\", mdx(\"a\", {\n    parentName: \"h3\",\n    \"href\": \"#cinvalidfeedback\",\n    \"aria-label\": \"cinvalidfeedback permalink\",\n    \"className\": \"anchor-link after\"\n  }, mdx(\"span\", {\n    parentName: \"a\"\n  }, \"#\"))), mdx(\"ul\", null, mdx(\"li\", {\n    parentName: \"ul\"\n  }, \"Component is depracated, use \", mdx(\"inlineCode\", {\n    parentName: \"li\"\n  }, \"<CCFormFeedback invalid>\"), \" instead of.\")), mdx(\"h2\", {\n    \"id\": \"layout\",\n    \"style\": {\n      \"position\": \"relative\"\n    }\n  }, \"Layout\", mdx(\"a\", {\n    parentName: \"h2\",\n    \"href\": \"#layout\",\n    \"aria-label\": \"layout permalink\",\n    \"className\": \"anchor-link after\"\n  }, mdx(\"span\", {\n    parentName: \"a\"\n  }, \"#\"))), mdx(\"h3\", {\n    \"id\": \"ccontainer\",\n    \"style\": {\n      \"position\": \"relative\"\n    }\n  }, \"CContainer\", mdx(\"a\", {\n    parentName: \"h3\",\n    \"href\": \"#ccontainer\",\n    \"aria-label\": \"ccontainer permalink\",\n    \"className\": \"anchor-link after\"\n  }, mdx(\"span\", {\n    parentName: \"a\"\n  }, \"#\"))), mdx(\"ul\", null, mdx(\"li\", {\n    parentName: \"ul\"\n  }, \"Deprecated property \", mdx(\"inlineCode\", {\n    parentName: \"li\"\n  }, \"tag\"), \".\"), mdx(\"li\", {\n    parentName: \"ul\"\n  }, \"Deprecated property \", mdx(\"inlineCode\", {\n    parentName: \"li\"\n  }, \"innerRef\"), \".\")), mdx(\"h3\", {\n    \"id\": \"ccol\",\n    \"style\": {\n      \"position\": \"relative\"\n    }\n  }, \"CCol\", mdx(\"a\", {\n    parentName: \"h3\",\n    \"href\": \"#ccol\",\n    \"aria-label\": \"ccol permalink\",\n    \"className\": \"anchor-link after\"\n  }, mdx(\"span\", {\n    parentName: \"a\"\n  }, \"#\"))), mdx(\"ul\", null, mdx(\"li\", {\n    parentName: \"ul\"\n  }, \"Deprecated property \", mdx(\"inlineCode\", {\n    parentName: \"li\"\n  }, \"tag\"), \".\"), mdx(\"li\", {\n    parentName: \"ul\"\n  }, \"Deprecated property \", mdx(\"inlineCode\", {\n    parentName: \"li\"\n  }, \"width\"), \", use \", mdx(\"inlineCode\", {\n    parentName: \"li\"\n  }, \"xs\"), \", \", mdx(\"inlineCode\", {\n    parentName: \"li\"\n  }, \"sm\"), \", \", mdx(\"inlineCode\", {\n    parentName: \"li\"\n  }, \"md\"), \", \", mdx(\"inlineCode\", {\n    parentName: \"li\"\n  }, \"lg\"), \", \", mdx(\"inlineCode\", {\n    parentName: \"li\"\n  }, \"xl\"), \", \", mdx(\"inlineCode\", {\n    parentName: \"li\"\n  }, \"xxl\"), \".\")), mdx(\"h3\", {\n    \"id\": \"crow\",\n    \"style\": {\n      \"position\": \"relative\"\n    }\n  }, \"CRow\", mdx(\"a\", {\n    parentName: \"h3\",\n    \"href\": \"#crow\",\n    \"aria-label\": \"crow permalink\",\n    \"className\": \"anchor-link after\"\n  }, mdx(\"span\", {\n    parentName: \"a\"\n  }, \"#\"))), mdx(\"ul\", null, mdx(\"li\", {\n    parentName: \"ul\"\n  }, \"Deprecated property \", mdx(\"inlineCode\", {\n    parentName: \"li\"\n  }, \"alignHorizontal\"), \".\"), mdx(\"li\", {\n    parentName: \"ul\"\n  }, \"Deprecated property \", mdx(\"inlineCode\", {\n    parentName: \"li\"\n  }, \"alignVertical\"), \".\"), mdx(\"li\", {\n    parentName: \"ul\"\n  }, \"Deprecated property \", mdx(\"inlineCode\", {\n    parentName: \"li\"\n  }, \"form\"), \".\"), mdx(\"li\", {\n    parentName: \"ul\"\n  }, \"Deprecated property \", mdx(\"inlineCode\", {\n    parentName: \"li\"\n  }, \"gutters\"), \".\"), mdx(\"li\", {\n    parentName: \"ul\"\n  }, \"Deprecated property \", mdx(\"inlineCode\", {\n    parentName: \"li\"\n  }, \"tag\"), \".\"), mdx(\"li\", {\n    parentName: \"ul\"\n  }, \"Deprecated property \", mdx(\"inlineCode\", {\n    parentName: \"li\"\n  }, \"width\"), \", use \", mdx(\"inlineCode\", {\n    parentName: \"li\"\n  }, \"xs\"), \", \", mdx(\"inlineCode\", {\n    parentName: \"li\"\n  }, \"sm\"), \", \", mdx(\"inlineCode\", {\n    parentName: \"li\"\n  }, \"md\"), \", \", mdx(\"inlineCode\", {\n    parentName: \"li\"\n  }, \"lg\"), \", \", mdx(\"inlineCode\", {\n    parentName: \"li\"\n  }, \"xl\"), \", \", mdx(\"inlineCode\", {\n    parentName: \"li\"\n  }, \"xxl\"), \".\")));\n}\n;\nMDXContent.isMDXComponent = true;","frontmatter":{"title":"","description":"Track and review changes to the CoreUI for React.js components to help you migrate from v3 to v4.","name":"Migration to v4","route":"/migration/v4"},"tableOfContents":{"items":[{"url":"#components","title":"Components","items":[{"url":"#calert","title":"CAlert"},{"url":"#cbadge","title":"CBadge"},{"url":"#cbreadcrumb","title":"CBreadcrumb"},{"url":"#cbutton","title":"CButton"},{"url":"#ccallout","title":"CCallout"},{"url":"#ccard","title":"CCard"},{"url":"#ccarousel","title":"CCarousel"},{"url":"#ccollapse","title":"CCollapse"},{"url":"#cdropdown","title":"CDropdown"},{"url":"#cembed","title":"CEmbed"},{"url":"#cfade","title":"CFade"},{"url":"#cheader","title":"CHeader"},{"url":"#cimg","title":"CImg"},{"url":"#cjumbotron","title":"CJumbotron"},{"url":"#clistgroup","title":"CListGroup"},{"url":"#cmedia","title":"CMedia"},{"url":"#cmodal","title":"CModal"},{"url":"#cnav","title":"CNav"},{"url":"#cnavbar","title":"CNavbar"},{"url":"#cpagination","title":"CPagination"},{"url":"#cpopover","title":"CPopover"},{"url":"#cprogress","title":"CProgress"},{"url":"#cprogressbar","title":"CProgressBar"},{"url":"#csidebar","title":"CSidebar"},{"url":"#cswitch","title":"CSwitch"},{"url":"#cspinner","title":"CSpinner"},{"url":"#ctabs","title":"CTabs"},{"url":"#ctoast","title":"CToast"},{"url":"#ctoggler","title":"CToggler"},{"url":"#ctooltip","title":"CTooltip"}]},{"url":"#forms","title":"Forms","items":[{"url":"#cformgroup","title":"CFormGroup"},{"url":"#cinput","title":"CInput"},{"url":"#cinputcheckbox","title":"CInputCheckbox"},{"url":"#cinputfile","title":"CInputFile"},{"url":"#cinputradio","title":"CInputRadio"},{"url":"#cinputgroup","title":"CInputGroup"},{"url":"#cselect","title":"CSelect"},{"url":"#cvalidfeedback","title":"CValidFeedback"},{"url":"#cinvalidfeedback","title":"CInvalidFeedback"}]},{"url":"#layout","title":"Layout","items":[{"url":"#ccontainer","title":"CContainer"},{"url":"#ccol","title":"CCol"},{"url":"#crow","title":"CRow"}]}]}}},"pageContext":{"id":"2c027c7e-1c64-538b-a27f-863020214b02"}},"staticQueryHashes":["4202924991"]}