{"componentChunkName":"component---src-templates-docs-tsx","path":"/templates/installation/","result":{"data":{"site":{"siteMetadata":{"title":"CoreUI for React.js"}},"mdx":{"id":"ce2e7fc1-28af-5339-9ace-f2339bf1837b","body":"var _excluded = [\"components\"];\n\nfunction _extends() { _extends = Object.assign ? Object.assign.bind() : function (target) { for (var i = 1; i < arguments.length; i++) { var source = arguments[i]; for (var key in source) { if (Object.prototype.hasOwnProperty.call(source, key)) { target[key] = source[key]; } } } return target; }; return _extends.apply(this, arguments); }\n\nfunction _objectWithoutProperties(source, excluded) { if (source == null) return {}; var target = _objectWithoutPropertiesLoose(source, excluded); var key, i; if (Object.getOwnPropertySymbols) { var sourceSymbolKeys = Object.getOwnPropertySymbols(source); for (i = 0; i < sourceSymbolKeys.length; i++) { key = sourceSymbolKeys[i]; if (excluded.indexOf(key) >= 0) continue; if (!Object.prototype.propertyIsEnumerable.call(source, key)) continue; target[key] = source[key]; } } return target; }\n\nfunction _objectWithoutPropertiesLoose(source, excluded) { if (source == null) return {}; var target = {}; var sourceKeys = Object.keys(source); var key, i; for (i = 0; i < sourceKeys.length; i++) { key = sourceKeys[i]; if (excluded.indexOf(key) >= 0) continue; target[key] = source[key]; } return target; }\n\n/* @jsxRuntime classic */\n\n/* @jsx mdx */\nvar _frontmatter = {\n  \"title\": \"React templates installation\",\n  \"name\": \"React templates installation\",\n  \"description\": \"Learn how to use CoreUI React Admin Dashboard Templates including npm scripts to build templates, compile source code, run tests, and more.\",\n  \"menu\": \"Templates\",\n  \"route\": \"/templates/admin-dashboard\"\n};\nvar layoutProps = {\n  _frontmatter: _frontmatter\n};\nvar MDXLayout = \"wrapper\";\nreturn function MDXContent(_ref) {\n  var components = _ref.components,\n      props = _objectWithoutProperties(_ref, _excluded);\n\n  return mdx(MDXLayout, _extends({}, layoutProps, props, {\n    components: components,\n    mdxType: \"MDXLayout\"\n  }), mdx(\"h2\", {\n    \"id\": \"tooling-setup\",\n    \"style\": {\n      \"position\": \"relative\"\n    }\n  }, \"Tooling setup\", mdx(\"a\", {\n    parentName: \"h2\",\n    \"href\": \"#tooling-setup\",\n    \"aria-label\": \"tooling setup permalink\",\n    \"className\": \"anchor-link after\"\n  }, mdx(\"span\", {\n    parentName: \"a\"\n  }, \"#\"))), mdx(\"p\", null, \"CoreUI React Admin Templates uses \", mdx(\"a\", {\n    parentName: \"p\",\n    \"href\": \"https://docs.npmjs.com/misc/scripts/\",\n    \"target\": \"_blank\",\n    \"rel\": \"nofollow\"\n  }, \"npm scripts\"), \" for its build system. Our \", mdx(\"inlineCode\", {\n    parentName: \"p\"\n  }, \"package.json\"), \" includes convenient methods for working with the framework, including compiling code, running tests, and more.\"), mdx(\"p\", null, \"To use our build system and run our admin template locally, you'll need a copy of source files and Node. Follow these steps and you should be ready to rock:\"), mdx(\"ol\", null, mdx(\"li\", {\n    parentName: \"ol\"\n  }, mdx(\"a\", {\n    parentName: \"li\",\n    \"href\": \"https://nodejs.org/en/download/\",\n    \"target\": \"_blank\",\n    \"rel\": \"nofollow\"\n  }, \"Download and install Node.js\"), \", which we use to manage our dependencies.\"), mdx(\"li\", {\n    parentName: \"ol\"\n  }, \"If you prefer to use Yarn instead of NPM, you have to \", mdx(\"a\", {\n    parentName: \"li\",\n    \"href\": \"https://classic.yarnpkg.com/lang/en/docs/install/\",\n    \"target\": \"_blank\",\n    \"rel\": \"nofollow\"\n  }, \"download and install it\")), mdx(\"li\", {\n    parentName: \"ol\"\n  }, mdx(\"a\", {\n    parentName: \"li\",\n    \"href\": \"https://coreui.io/product/free-react-admin-template/\",\n    \"target\": \"_blank\",\n    \"rel\": \"nofollow\"\n  }, \"Download CoreUI React Admin Template\"), \" or \", mdx(\"a\", {\n    parentName: \"li\",\n    \"href\": \"https://coreui.io/download/\",\n    \"target\": \"_blank\",\n    \"rel\": \"nofollow\"\n  }, \"Download CoreUI PRO React Admin Template\"), \".\"), mdx(\"li\", {\n    parentName: \"ol\"\n  }, \"Navigate to the root template directory and run \", mdx(\"inlineCode\", {\n    parentName: \"li\"\n  }, \"npm install\"), \" or \", mdx(\"inlineCode\", {\n    parentName: \"li\"\n  }, \"yarn install\"), \" to install our local dependencies listed in \", mdx(\"inlineCode\", {\n    parentName: \"li\"\n  }, \"package.json\"), \".\")), mdx(\"p\", null, \"When completed, you'll be able to run the various commands provided from the command line.\"), mdx(\"h2\", {\n    \"id\": \"using-npm-scripts\",\n    \"style\": {\n      \"position\": \"relative\"\n    }\n  }, \"Using npm scripts\", mdx(\"a\", {\n    parentName: \"h2\",\n    \"href\": \"#using-npm-scripts\",\n    \"aria-label\": \"using npm scripts permalink\",\n    \"className\": \"anchor-link after\"\n  }, mdx(\"span\", {\n    parentName: \"a\"\n  }, \"#\"))), mdx(\"p\", null, \"Our \", mdx(\"inlineCode\", {\n    parentName: \"p\"\n  }, \"package.json\"), \" includes numerous tasks for developing the project. Run \", mdx(\"inlineCode\", {\n    parentName: \"p\"\n  }, \"npm run\"), \" or \", mdx(\"inlineCode\", {\n    parentName: \"p\"\n  }, \"yarn run\"), \" to see all the npm scripts in your terminal. \", mdx(\"strong\", {\n    parentName: \"p\"\n  }, \"Primary tasks include:\")), mdx(\"table\", null, mdx(\"thead\", {\n    parentName: \"table\"\n  }, mdx(\"tr\", {\n    parentName: \"thead\"\n  }, mdx(\"th\", {\n    parentName: \"tr\",\n    \"align\": null\n  }, \"Task\"), mdx(\"th\", {\n    parentName: \"tr\",\n    \"align\": null\n  }, \"Description\"))), mdx(\"tbody\", {\n    parentName: \"table\"\n  }, mdx(\"tr\", {\n    parentName: \"tbody\"\n  }, mdx(\"td\", {\n    parentName: \"tr\",\n    \"align\": null\n  }, mdx(\"inlineCode\", {\n    parentName: \"td\"\n  }, \"npm start\"), \" or \", mdx(\"inlineCode\", {\n    parentName: \"td\"\n  }, \"yarn start\")), mdx(\"td\", {\n    parentName: \"tr\",\n    \"align\": null\n  }, \"Compiles CSS and JavaScript, builds the documentation, and starts a local server.\")), mdx(\"tr\", {\n    parentName: \"tbody\"\n  }, mdx(\"td\", {\n    parentName: \"tr\",\n    \"align\": null\n  }, mdx(\"inlineCode\", {\n    parentName: \"td\"\n  }, \"npm run build\"), \" or \", mdx(\"inlineCode\", {\n    parentName: \"td\"\n  }, \"yarn build\")), mdx(\"td\", {\n    parentName: \"tr\",\n    \"align\": null\n  }, \"Creates the \", mdx(\"inlineCode\", {\n    parentName: \"td\"\n  }, \"dist/\"), \" directory with compiled files. Uses \", mdx(\"a\", {\n    parentName: \"td\",\n    \"href\": \"https://sass-lang.com/\",\n    \"target\": \"_blank\",\n    \"rel\": \"nofollow\"\n  }, \"Sass\"), \", \", mdx(\"a\", {\n    parentName: \"td\",\n    \"href\": \"https://github.com/postcss/autoprefixer\",\n    \"target\": \"_blank\",\n    \"rel\": \"nofollow\"\n  }, \"Autoprefixer\"), \".\")), mdx(\"tr\", {\n    parentName: \"tbody\"\n  }, mdx(\"td\", {\n    parentName: \"tr\",\n    \"align\": null\n  }, mdx(\"inlineCode\", {\n    parentName: \"td\"\n  }, \"npm test\"), \" or \", mdx(\"inlineCode\", {\n    parentName: \"td\"\n  }, \"yarn test\")), mdx(\"td\", {\n    parentName: \"tr\",\n    \"align\": null\n  }, \"Runs tests locally\")))), mdx(\"h2\", {\n    \"id\": \"sass\",\n    \"style\": {\n      \"position\": \"relative\"\n    }\n  }, \"Sass\", mdx(\"a\", {\n    parentName: \"h2\",\n    \"href\": \"#sass\",\n    \"aria-label\": \"sass permalink\",\n    \"className\": \"anchor-link after\"\n  }, mdx(\"span\", {\n    parentName: \"a\"\n  }, \"#\"))), mdx(\"p\", null, \"CoreUI uses \", mdx(\"a\", {\n    parentName: \"p\",\n    \"href\": \"https://sass-lang.com/dart-sass\",\n    \"target\": \"_blank\",\n    \"rel\": \"nofollow\"\n  }, \"Dart Sass\"), \" for compiling our Sass source files into CSS files (included in our build process), and we recommend you do the same if you're compiling Sass using your own asset pipeline.\"), mdx(\"p\", null, \"Dart Sass uses a rounding precision of 10 and for efficiency reasons does not allow adjustment of this value. We don't lower this precision during further processing of our generated CSS, such as during minification, but if you chose to do so we recommend maintaining a precision of at least 6 to prevent issues with browser rounding.\"), mdx(\"h2\", {\n    \"id\": \"autoprefixer\",\n    \"style\": {\n      \"position\": \"relative\"\n    }\n  }, \"Autoprefixer\", mdx(\"a\", {\n    parentName: \"h2\",\n    \"href\": \"#autoprefixer\",\n    \"aria-label\": \"autoprefixer permalink\",\n    \"className\": \"anchor-link after\"\n  }, mdx(\"span\", {\n    parentName: \"a\"\n  }, \"#\"))), mdx(\"p\", null, \"We uses \", \"[Autoprefixer][autoprefixer]\", \" (included in our build process) to automatically add vendor prefixes to some CSS properties at build time. Doing so saves us time and code by allowing us to write key parts of our CSS a single time while eliminating the need for vendor mixins like those found in v3.\"), mdx(\"p\", null, \"We maintain the list of browsers supported through Autoprefixer in a separate file within our GitHub repository. See \", mdx(\"inlineCode\", {\n    parentName: \"p\"\n  }, \".browserslistrc\"), \".\"), mdx(\"h2\", {\n    \"id\": \"local-template\",\n    \"style\": {\n      \"position\": \"relative\"\n    }\n  }, \"Local template\", mdx(\"a\", {\n    parentName: \"h2\",\n    \"href\": \"#local-template\",\n    \"aria-label\": \"local template permalink\",\n    \"className\": \"anchor-link after\"\n  }, mdx(\"span\", {\n    parentName: \"a\"\n  }, \"#\"))), mdx(\"p\", null, \"Here's how to get it started:\"), mdx(\"ol\", null, mdx(\"li\", {\n    parentName: \"ol\"\n  }, \"Run through the \", mdx(\"a\", {\n    parentName: \"li\",\n    \"href\": \"#tooling-setup\"\n  }, \"tooling setup\"), \" above to install all dependencies.\"), mdx(\"li\", {\n    parentName: \"ol\"\n  }, \"From the root template directory, run \", mdx(\"inlineCode\", {\n    parentName: \"li\"\n  }, \"npm run start\"), \" or \", mdx(\"inlineCode\", {\n    parentName: \"li\"\n  }, \"yarn start\"), \" in the command line.\"), mdx(\"li\", {\n    parentName: \"ol\"\n  }, \"Open \", mdx(\"inlineCode\", {\n    parentName: \"li\"\n  }, \"http://localhost:3000\"), \" in your browser, and voil\\xE0.\")), mdx(\"h2\", {\n    \"id\": \"troubleshooting\",\n    \"style\": {\n      \"position\": \"relative\"\n    }\n  }, \"Troubleshooting\", mdx(\"a\", {\n    parentName: \"h2\",\n    \"href\": \"#troubleshooting\",\n    \"aria-label\": \"troubleshooting permalink\",\n    \"className\": \"anchor-link after\"\n  }, mdx(\"span\", {\n    parentName: \"a\"\n  }, \"#\"))), mdx(\"p\", null, \"Should you encounter problems with installing dependencies, uninstall all previous dependency versions (global and local). Then, rerun \", mdx(\"inlineCode\", {\n    parentName: \"p\"\n  }, \"npm install\"), \" or \", mdx(\"inlineCode\", {\n    parentName: \"p\"\n  }, \"yarn install\"), \".\"));\n}\n;\nMDXContent.isMDXComponent = true;","frontmatter":{"title":"React templates installation","description":"Learn how to use CoreUI React Admin Dashboard Templates including npm scripts to build templates, compile source code, run tests, and more.","name":"React templates installation","route":"/templates/admin-dashboard"},"tableOfContents":{"items":[{"url":"#tooling-setup","title":"Tooling setup"},{"url":"#using-npm-scripts","title":"Using npm scripts"},{"url":"#sass","title":"Sass"},{"url":"#autoprefixer","title":"Autoprefixer"},{"url":"#local-template","title":"Local template"},{"url":"#troubleshooting","title":"Troubleshooting"}]}}},"pageContext":{"id":"ce2e7fc1-28af-5339-9ace-f2339bf1837b"}},"staticQueryHashes":["4202924991"]}